text,label,score,url,hn_link,pre_labeled,notes
"1. genesis was innocent &#x2F; no quantum &#x2F; etc -- we were just solving K:V and V:K associative memory issues for clients in construction, healthcare, finance, etc. 2. PhD etc was at center of linear algebra, data compression, analog&#x2F;digital comms, and some adjacent fields, all classical other than quantum dabbling 3. also was aware that decoder-only models only recognize star-free grammars and can only reason in TC^0, along with some other computing limits 4. my goto thesis is &quot;make simplifying assumptions&quot;, and so around 2-3 years ago one day said (1) let&#x27;s just treat any AI like a black box comms channel 5. since can&#x27;t boost signal power in watts sense, that pretty much leaves error-correcting codes, where most natural thing to do in LLM construct was constant-width prefix-free linear block code (section 3.2 or so in paper) 6. one thing followed another after that -- let&#x27;s not just use any old token, let&#x27;s use Unicode PUA, let&#x27;s not use any old ECC &#x2F; QEC, let&#x27;s construct a way to implement very particular codes in 1D prompt 7. which is to say, in the end, it boils down to the following simple thing -- we constrain the prompt to a series of alternating emergent unitary operations in the A-B-A-B... sense of Trotterisation that amounts to projecting an interleaved globally phase coherent spacetime code between sufficiently finite blocks of content tokens, where A_i: hypertoken codeword, e.g. if using simply lowercase Latin, say a-c,d-h,i-o a valid codeword is adg or ceh etc, and no codeword should be provided, AND each position should have a coprime number of symbols (think 3 qudits) B_i: next content block -- some finite number of tokens -- in current version this is fixed tho 2nd or 3rd paper gets into how to make this block length ragged &#x2F; adaptive, similar to UDD &#x2F; dynamic decoupling, Huffman coding, etc. 8. one key requirement is that some nesting mechanism similar to FFT must be provided -- this can be implicit or explicit and we really save most of that for a second paper currently in draft, that and some other subtleties are likely to much to get into in this abbreviated description 9. Grover&#x27;s simulation was a subtlety one day when we realized we should simply define a pair of lanes with disjoint sqrt(n) symbols and use that as value-key reverse associative lookup, e.g., A1,the quick brown fox,&#x2F;A1
A2,jumped over the lazy dog,&#x2F;A2
B1,every good boy,&#x2F;B1
B2,does fine,&#x2F;B2 AND by way of KVQ attention it collapses to 1D chain where the next key is also the reverse key of prior value A1,the quick brown fox,A2,jumped over the lazy dog,B1,every good boy,B2,does fine... that was also around the time we took a pretty deep breath and started digging on all things quantum 10. that the whole thing works can seem very wait, but why, and it really boils down to following -- if we use sufficiently untrained tokens, they have a random Gaussian frozen initial state. By forcing the prefix-free constant width disjoint symbols on CRT coprime lanes and the rest of the machinery, we essentially force the model to recall and reason over a sufficiently discretized branched lattice with sufficiently high spikes at our hypertoken codewords and this spike is projected onto the value tokens by way of attention. 11. That works because chaining projections onto frozen Gaussians is equivalent to chaining sufficiently orthogonal Krylov evolution with restart, which is equivalent to chaining eigenvector iteration, which is a classic way to do Trotter slicing and coarsening Lagrangians &#x2F; estimate Hamiltonians. We can also arrive at the same conclusion by realizing this is exactly equivalent to doing a certain asymmetric compressed sensing operation in the RIP&#x2F;REC sense and whether we look at it via Krylov&#x2F;Eigen or Compressed Sensing or that our disjoint symbols over disjoint symbols is also a zigzag expander over the raw prompt aka fast mixing, then in all cases we diagonalize the Fisher matrix fairly rapidly. There are some caveats here since this is mere prompt injection &#x2F; our next natural step is LoRA. 12. Which is a long way of getting around to answering your question on quantum sim -- we should in theory be able to construct a new type of 1D MPO &#x2F; MPS &#x2F; TN chain to sim pretty much any quantum circuit. Our current machinery can likely get us to BQP, possibly some parts of BPP, especially if we consider that our codewords can be defined in various ways that specify the equivalent of a quantum annealing schedule (QAOA). That&#x27;s also a natural next step 13. The other corollary that immediately follows is we should be able to use this machinery to optimize any PLL system, black box or otherwise using this sort of quantum error correction 1D injection, because in all cases, and especially if we lean on the compressed sensing mathematics, we are converting latent phase entropy into source entropy, and we do that about as efficiently as possible in the 1D sense. 14. ONE massive caveat -- it is critical that the model be empirically tested for what we first called entropy tests, and later oracles, and are shifting simply to unitary operators in the following sense -- the width of B_i your token blocks is tied to relevant subtasks for which the model can get correct up to your desired level of fidelity. In the paper update, we speak to various types of tests such as how many Bernoulli trials can the model correctly guess majority heads&#x2F;tails or recall the heads&#x2F;tail sequence, or sort a list -- these are relative to high-entropy random inputs, where most models will have a base window of 16-256 tokens for content payload 15. init release will have those token window evals, options for various codeword encodings, prebuilt CRT combos, some key relevant ECCs &#x2F; QECS to walk the key space, and some other key things so that anyone can use it for enhanced recall, along with some mechanisms or examples on reasoning, where our target is a prompt compiler that exploits these classic and quantum error-correcting principles. One very simplifying and relevant POV on that is indexing grammars were the same trick used to solve register allocation in compilers, we&#x27;ve just built a very proper indexing grammar to solve the quantum register allocation problem.",discussion,0,https://news.ycombinator.com/item?id=44794452,https://news.ycombinator.com/item?id=44794452,1,off-topic career rambling — consider discarding
"Wonderful article, but link entered into text field rather than URL field.  http://scottaaronson.com/blog/?p=208  (clickable version). Beautiful explanation of the Quantum Fourier Transform and some practical aspects of quantum computing without any domain-specific math.",technical,0,https://news.ycombinator.com/item?id=985676,https://news.ycombinator.com/item?id=985676,1,
"Okay then. I wanna know of a better way to take four 1 GSPS signals, demodulate them, and pump out another two 1 GSPS signals which encode decisions made every every four samples on the incoming signals. That&#x27;s ONE of the problems in quantum control for stabilizing one qubit. We did it with an FPGA. If you know of a DSP or systolic array or processor or what have you for doing this, I&#x27;m ALL ears. Oh and the timing must be COMPLETELY deterministic down to the nanosecond. In fact, if you know of ANY general purpose hardware that will talk to gigasample ADCs&#x2F;DACs, I&#x27;d love to know about it.",technical,0,https://news.ycombinator.com/item?id=8668515,https://news.ycombinator.com/item?id=8668515,1,
"It depends on what you mean by layman.  I found the book Quantum Computing Since Democritus by Scott Aaronson to be very easy to understand, but it does require some linear algebra and complex numbers.  I don&#x27;t think you can get a good overview of entanglement (where the madness lies) without that basic level. Check  http:&#x2F;&#x2F;www.scottaaronson.com&#x2F;democritus&#x2F;  and see if it works for you. Otherwise, you are in the realm of popularizers like John Gribbin, who I found entertaining but not very enlightening.",discussion,0,https://news.ycombinator.com/item?id=9579610,https://news.ycombinator.com/item?id=9579610,1,
"This feels like pearl clutching. We do not need &quot;proof&quot;. We lived without it, and we&#x27;ll live without it again. I grew up before broadband - we survived without photographing every moment, too. It was actually kind of nice. Social media is the real fluke of our era, not image generation. And hypothetically if these cryptographic &quot;non-AI really super serious real&quot; verification systems do become in vogue, what happens if quantum supremacy beats crypto? What then? You don&#x27;t even need to beat all of crypto. Just beat the signing algorithm. I&#x27;m sure it&#x27;s going to happen all the time with such systems, then none of the data can be &quot;trusted&quot; anyway. I&#x27;m stretching a bit here, but this feels like &quot;NFTs for life&#x27;s moments&quot;. Designed just to appease the haters. You aren&#x27;t going to need this stuff. Life will continue.",discussion,0,https://news.ycombinator.com/item?id=45691033,https://news.ycombinator.com/item?id=45691033,1,off-topic Apple Watch comment — discard
"IBM Warns Quantum Computing Will Break Encryption https:&#x2F;&#x2F;www.zdnet.com&#x2F;article&#x2F;ibm-warns-of-instant-breaking-of-encryption-by-quantum-computers-move-your-data-today<p>Quantum computers will be able to instantly break the encryption of sensitive data protected by today&#x27;s strongest security, warns the head of IBM Research. This could happen in a little more than five years because of advances in quantum computer technologies. &quot;Anyone that wants to make sure that their data is protected for longer than 10 years should move to alternate forms of encryption now,&quot; said Arvind Krishna, director of IBM Research.<p>Correct me if I&#x27;m wrong, but does it mean that my KeePass database that I uploaded on Dropbox is going to be broken in ~5 years time and I need to start changing my passwords right now?",hype,7,https://news.ycombinator.com/item?id=17110168,https://news.ycombinator.com/item?id=17110168,1,IBM warns encryption breaks in 5 years — headline hype
Quantum Computing and startups How far are we to make quantum computing something from a lab to a start-up? What it&#x27;s needed to make the transition?,discussion,2,https://news.ycombinator.com/item?id=8127055,https://news.ycombinator.com/item?id=8127055,1,
Just How Big – Or Small – Is the Quantum Computing Racket? – The Next Platform,discussion,3,https://www.nextplatform.com/2023/09/06/just-how-big-or-small-is-the-quantum-computing-racket/,https://news.ycombinator.com/item?id=37431682,1,
"So the basics: - quantum physics are real, this isn&#x27;t about debating that. The theory underpinning quantum computing is real. - quantum annealing is theoretically real, but not the same &quot;breakthrough&quot; that a quantum computer would be. Z-wave and google have made these. - All benchmark computations have been about simulating a smaller quantum computer or annealer. which these systems can do faster than a brute force classical search. These are literally the only situation where &quot;quantum supremacy&quot; exists. - There is literally no claim of &quot;productive&quot; computation being made by a quantum computer. Only simulations of our assumptions about quantum systems. - The critical gap is &quot;quantum error correction&quot;, proof that they can use many error prone physical qubits to simulate a smaller system with lower error. There isn&#x27;t proof yet that is actually possible. This result they are claiming, is they have &quot;critical error correction&quot; is the single most groundbreaking result we could have  in quantum computing. Their evidence does not satisfy the burden of proof. They also only claim to have 1 qubit, which is intrinsically useless, and doesn&#x27;t examine the costs of simulating multiple interacting qubits.",technical,0,https://news.ycombinator.com/item?id=42377069,https://news.ycombinator.com/item?id=42377069,1,
"This has already been discussed on HN[1].
There have been some minor updates to the paper,
here is the diff:       &lt; are the gear-based computers of Vergis, Steiglitz, Dickinson , and
    &gt; are the gear-based computers of Vergis, Steiglitz, and Dickinson , and
    
    &lt; (called Steiner vertices) other than the pegs themselves.  Garey,
    &gt; (called Steiner vertices) other than the points themselves.  Garey,
    
    &lt; spacetimes cannot be globally hyperbolic; that is to say, they must
    &gt; spacetimes cannot be globally hyperbolic; for example, they could
    
    &lt; a polynomial number of bits (or qubits) around that curve.  Bacon
    &gt; a polynomial number of bits (or qubits) around that CTC.  Bacon
    
    &lt; I thank Al Aho, Pioter Drubetskoy, Daniel Gottesman, David Poulin,
    &lt; John Preskill, and others who I have undoubtedly forgotten for
    &lt; enlightening conversations about the subject of this article.  I
    &lt; especially thank Dave Bacon, Dan Christensen, and Antony Valentini
    &lt; for critiquing a draft, and Lane Hemaspaandra for pestering me to
    &lt; finish the damn thing.
    &gt; I thank Al Aho, Pioter Drubetskoy, Daniel Gottesman, Klas Markstrom,
    &gt; David Poulin, John Preskill, and others who I have undoubtedly
    &gt; forgotten for enlightening conversations about the subject of this
    &gt; article.  I especially thank Dave Bacon, Dan Christensen, and Antony
    &gt; Valentini for critiquing a draft, and Lane Hemaspaandra for pestering
    &gt; me to finish the damn thing.

  
[1]  https:&#x2F;&#x2F;news.ycombinator.com&#x2F;item?id=8942220",discussion,0,https://news.ycombinator.com/item?id=9601049,https://news.ycombinator.com/item?id=9601049,1,off-topic graph algorithm — discard
"Here&#x27;s Scott Aaronson&#x27;s answer to a similar question on his blog a couple of weeks ago:  Yes, Nielsen and Chuang is the standard textbook for quantum computing; it’s excellent (even though 16 years old by now). If you wanted to start with something shorter and more introductory, you could try David Mermin’s “Introduction to Quantum Computer Science.”",discussion,0,https://news.ycombinator.com/item?id=9929278,https://news.ycombinator.com/item?id=9929278,1,
Show HN: 1-qubit quantum circuit simulator with interactive bloch sphere This has been a small labour of love for a few days. Just a fun idea I had to create a single qubit quantum circuit simulator with interactive 3D bloch sphere.<p>Check out my blog post linked on the page for further introduction to quantum computing!,technical,7,https://dazkins.com/qubitSimulator,https://news.ycombinator.com/item?id=39657567,1,
Scott Aaronson is the guy who keeps claiming quantum supremacy is here every year so he&#x27;s like the proverbial pot calling the kettle black.,discussion,0,https://news.ycombinator.com/item?id=47318358,https://news.ycombinator.com/item?id=47318358,1,
"&gt; The only exception seems to be Quantum Computing Yet so far it failed to do any useful work, correct? As I understand it, even the recent &quot;quantum supremacy&quot; results were about performing a humongous number of useless computations.",discussion,0,https://news.ycombinator.com/item?id=44772554,https://news.ycombinator.com/item?id=44772554,1,
"Ask HN: As a developer – should I be getting ready for quantum computing? Consider the alternatives to focus on : 
1. Being just really good at what I do 
2. Climbing the management ladder",discussion,2,https://news.ycombinator.com/item?id=14388994,https://news.ycombinator.com/item?id=14388994,1,
"&quot;IBM lays out clear path to fault-tolerant quantum computing&quot;. IBM Quantum Computing Blog. (2025-06). ; 2025 IBM Quantum Roadmap   https:&#x2F;&#x2F;www.ibm.com&#x2F;quantum&#x2F;blog&#x2F;large-scale-ftqc  - ( [2506.03094] Tour de gross: A modular quantum computer based on bivariate bicycle codes  https:&#x2F;&#x2F;arxiv.org&#x2F;abs&#x2F;2506.03094  ) - [2506.01779] &quot;Improved belief propagation is sufficient for real-time decoding of quantum memory&quot; (2025)   https:&#x2F;&#x2F;arxiv.org&#x2F;abs&#x2F;2506.01779  : &gt; Abstract: [...]  Relay-BP is inherently parallel, enabling rapid low-footprint decoding with FPGA or ASIC real-time implementations, similar to standard BP. A core aspect of our decoder is its enhancement of the standard BP algorithm by incorporating disordered memory strengths. This dampens oscillations and breaks symmetries that trap traditional BP algorithms.  - &quot;QUEKUF: An FPGA Union Find Decoder for Quantum Error Correction on the Toric Code&quot;. ACM Transactions on Reconfigurable Technology and Systems (2025)   https:&#x2F;&#x2F;dl.acm.org&#x2F;doi&#x2F;10.1145&#x2F;3733239  necst&#x2F;QUEKUF: &quot;Union Find Decoder for Quantum Error Correction on the Toric Code&quot;:   https:&#x2F;&#x2F;github.com&#x2F;necst&#x2F;QUEKUF",technical,0,https://news.ycombinator.com/item?id=45715471,https://news.ycombinator.com/item?id=45715471,1,
"The fusion of quantum computing, artificial intelligence (AI), and decentralized governance signals the emergence of a transformative paradigm we call Quantum Governance Intelligence (QGI). In this article, we explore how quantum-enhanced algorithms can revolutionize decentralized decision-making by addressing challenges in AI ethics, computational scalability, and systemic transparency. Integrating advances in quantum supremacy, ethical AI frameworks, and next-generation consensus mechanisms, QGI offers a visionary blueprint for achieving equitable and efficient governance. Drawing on case studies from healthcare, climate science, finance, and urban development, we demonstrate how QGI can optimize complex systems while upholding privacy and fairness. Yet, technical limitations, ethical dilemmas, and sociopolitical resistance remain formidable challenges. Through interdisciplinary collaboration and ongoing validation, QGI promises to redefine the evolution of technology in our post-digital era. This article synthesizes state-of-the-art research and presents a detailed roadmap for implementing QGI, advocating its potential to foster a more resilient and inclusive global society.",hype,0,https://news.ycombinator.com/item?id=43244193,https://news.ycombinator.com/item?id=43244193,1,quantum governance buzzword fusion — hype
"After quickly reading through the paper it seems that the 
algorithm they employ is very similar to Grover search [1], which provides a quadratic&#x2F;square-root speed-up for generic search problems, so O(2^m) -&gt; O(2^(n&#x2F;2)). Basically, they perform the following three steps: 1) Generate an even superposition of all possible solution states using a Hadamard transform (so go from |000000...&gt; to 1&#x2F;sqrt(N)*(|00000..0&gt;+|000...1&gt;+|1111...1&gt;). This is pretty standard and used in almost all quantum algorithms. 2) Evaluate each clause of their Boolean E3-CNF function on the superposed input state and transfer the results to a register of control qubits, which yields an entangled state of the input state qubits with these control qubits (akin to the Oracle operator in the Grover search algorithm that performs the operation |x&gt;|0&gt; -&gt; |x&gt;|f(x)&gt;, only here they use multiple Oracle functions and control qubits [which is fine of course]). This is a classical operation which we can implement in reversible computing btw, so no quantum magic involved here yet (apart from applying it to a superposed input state). 3) Increase the amplitude of the states that contain the solution to the search problem, very much akin to the rotation operator employed in Grover search that transfers amplitude from non-solution states to the solution state. &lt;- The problem might be here. So where I have trouble understanding the algorithm is when they apply the operator M_x to increase &quot;the amplitude of the truth vector of clauses with maximum number of satisfied clauses using a partial negation and iterative measurement technique&quot; (page 6 ff.). They seem to want to repeatedly apply that operator to the same state in order to maximize the amplitude transfer to the correct solution states. However, there is a rather simple proof that shows that the maximum amount of amplitude which you can transfer from one component of a quantum state to another using a control qubit is fundamentally limited by the Unitarian nature of quantum operations. This also limits the efficiency of quantum search in the general case and is the reason that we cannot achieve arbitrary speed-up in the Grover algorithm (see e.g. my PhD thesis for a simple explanation [2] or Grover&#x27;s original paper to get the full picture [3]). Basically this proof states that although we can generate the quantum information about the answer that we&#x27;re looking for, we cannot get that information out of the quantum system in an (exponentially) efficient way. It would be very exciting if this algorithm was correct of course, I just can&#x27;t imagine that someone would publish such an important finding on Arxiv.org without having it cross-checked and backed by some other people in the field first (which does not seem to be the case judging from the text). That being said, I think it should be not too difficult to simulate this algorithm and see if all of their transformations are actually unitary and possible to implement in reversible computing and if they correctly take into account the entanglement of individual control qubits and the corresponding wave function collapse due to the qubit measurements they perform. [1] Grover Search Algorithm -  https:&#x2F;&#x2F;en.wikipedia.org&#x2F;wiki&#x2F;Grover%27s_algorithm  [2] My PhD thesis on an Experimental Realization of Grover&#x27;s Algorithm - see page 136 ff. for a simple explanation of the effiency of quantum searching  http:&#x2F;&#x2F;iramis.cea.fr&#x2F;spec&#x2F;Pres&#x2F;Quantro&#x2F;static&#x2F;wp-content&#x2F;upl...  [3] Grover&#x27;s Algorithm - Original Paper  http:&#x2F;&#x2F;arxiv.org&#x2F;abs&#x2F;quant-ph&#x2F;9605043  [4] The No-Cloning Theorem:  https:&#x2F;&#x2F;en.wikipedia.org&#x2F;wiki&#x2F;No-cloning_theorem",technical,0,https://news.ycombinator.com/item?id=9929868,https://news.ycombinator.com/item?id=9929868,1,
"Ask HN: What are the best books about Quantum Computing for beginners? As I searched for Quantum Computing books, I didn&#x27;t have success to find the book that is written for non-technical person. For me, I understand the basics, but I have people around me who are not involved in Computer science and they are still interested to learn about Quantum Computing. Also, I found IBM&#x27;s videos very useful when I recommend them but still books are better structured in terms of learning the processes. Thanks.",discussion,3,https://news.ycombinator.com/item?id=17565564,https://news.ycombinator.com/item?id=17565564,1,
"&gt; So how many gates are we talking to factor some &quot;cryptographically useful&quot; number? That is a hard question to answer for two reasons.  First, there is no bright line that delineates &quot;cryptographically useful&quot;.  And second, the exact design of a QC that could do such a calculation is not yet known.  It&#x27;s kind of like trying to estimate how many traditional gates would be needed to build a &quot;semantically useful&quot; neural network back in 1985. But the answer is almost certainly in the millions. [UPDATE] There is a third reason this is hard to predict: for quantum error correction, there is a tradeoff between the error rate in the raw qbit and the number of gates needed to build a reliable error-corrected virtual qbit.  The lower the error rate in the raw qbit, the fewer gates are needed.  And there is no way to know at this point what kind of raw error rates can be achieved. &gt; Is there some pathway that makes quantum computers useful this century? This century has 75 years left in it, and that is an eternity in tech-time.  75 years ago the state of the art in classical computers was (I&#x27;ll be generous here) the Univac [1].  Figuring out how much less powerful it was than a modern computer makes an interesting exercise, especially if you do it in terms of ops&#x2F;watt.  I haven&#x27;t done the math, but it&#x27;s many, many, many orders of magnitude.  If the same progress can be achieved in quantum computing, then pre-quantum encryption is definitely toast by 2100.  And it pretty much took only one breakthrough, the transistor, to achieve the improvement in classical computing that we enjoy today.  We still don&#x27;t have the equivalent of that for QC, but who knows when or if it will happen.  Everything seems impossible until someone figures it out for the first time. --- [1]  https:&#x2F;&#x2F;en.wikipedia.org&#x2F;wiki&#x2F;UNIVAC_I#Technical_description",technical,0,https://news.ycombinator.com/item?id=45084350,https://news.ycombinator.com/item?id=45084350,1,
"You must look at this article about technological singularity.  http:&#x2F;&#x2F;en.wikipedia.org&#x2F;wiki&#x2F;Technological_singularity  In my opinion, the next programmers generation will do quantic computing. Crypto algorithms, protocols, softwares, we will have to rethink everything to get it working with qubits. ( http:&#x2F;&#x2F;en.wikipedia.org&#x2F;wiki&#x2F;Qubit )",hype,0,https://news.ycombinator.com/item?id=9679475,https://news.ycombinator.com/item?id=9679475,1,misspells quantum (quantic) — borderline hype/noise
