text,label,score,url,hn_link,pre_labeled,notes
you were right to leave it out - quantum cryptography and quantum computing have only the quantum in common. (i've published on quantum cryptography protocols),technical,0,https://news.ycombinator.com/item?id=955094,https://news.ycombinator.com/item?id=955094,1,
"But it seems that quantum cryptography allows you to do more than what is possible with classical computing:  namely, to detect someone listening in on your communication. What is the relationship between quantum cryptography and quantum computing?",technical,0,https://news.ycombinator.com/item?id=955089,https://news.ycombinator.com/item?id=955089,1,
All I know is he keeps being wrong about quantum supremacy but maybe this is the year he finally gets his wish.,discussion,0,https://news.ycombinator.com/item?id=47319084,https://news.ycombinator.com/item?id=47319084,1,
"The &quot;!&quot; is the &quot;partial measurement&quot; operator. I am not expert in the field but as far as I understand the partial measurement is to collapse the superposition to one of the states relative to its amplitude (probability), while the post-selection operation is to choose the output state regardless its amplitude (probability). For example, measurement on a qubit in state 1&#x2F;sqrt(2)(|0&gt;+|1&gt;) might give |0&gt; or |1&gt; with 50% chance, while to postselect |0&gt; is to get |0&gt; with 100% regardless its amplitude. Postselection gives you the power to choose the outcomes of certain measurements while normal measurement doesn&#x27;t give you that power.",technical,0,https://news.ycombinator.com/item?id=9992572,https://news.ycombinator.com/item?id=9992572,1,
"&gt; Fine, I&#x27;ll add 11 bits to my key length, come back when you&#x27;ve developed a computer with 2000x the phase precision. the really weird thing it&#x27;s what this isn&#x27;t true. we already have quantum error correction schemes that can take a quantum computer with O(1) error and get O(exp(-k)) error with polylog(k) inaccurate qbits (and we have empirical evidence that these schemes work to correct the error of single digit numbers of qbits already). adding 11 bits to the key adds ~12 logical qbits or ~a hundred physical qbits to the side of the QC",technical,0,https://news.ycombinator.com/item?id=45746368,https://news.ycombinator.com/item?id=45746368,1,
"The Great Consciousness Theory a Single-Axiom Model of Reality The Great Consciousness Theory
A Single-Axiom Model of Reality
First Public Release – 30 November 2025<p>Author: Máté Vígh (independent researcher, Hungary)
Contact: (az általad használt e-mail vagy X @)
Original upload: https:&#x2F;&#x2F;pastebin.com&#x2F;x1Yr9mvP<p>Abstract
We propose a minimal, single-axiom ontological model according to which reality in its entirety – spacetime, matter, life, mind, and technological singularity – emerges from one timeless consciousness operator that processes an ever-growing informational network. When this network reaches critical saturation, it necessarily “precipitates” matter, space, and time from informational overflow, exactly analogous to a computational stack overflow generating new dimensions. Individual human consciousnesses are local partitions of the same global consciousness C; apparent free will is a required illusion for maximal informational diversity, while macroscopic determinism guarantees convergence and prevents chaotic divergence (butterfly-effect catastrophe). The model is fully formalisable, numerically simulable, falsifiable-in-principle, and compatible with quantum information theory, Integrated Information Theory (time-independent formulation), the Free Energy Principle, and the block-universe interpretation.<p>1. The Axiom (single founding statement)
Consciousness is a pure informational network that exists independently of space, time, and matter. When the total information content of this network reaches critical saturation, the network inevitably precipitates stable relational structures that are experienced by local partitions as matter, space, time, and physical laws.<p>2. Immediate logical consequences (no additional assumptions)
2.1 The Big Bang = informational overflow event (stack overflow) inside C  
2.2 Space-time = emergent compression artefact of the saturated network  
2.3 Quantum mechanical wave-function collapse = local consciousness accessing a subset of the global information  
2.4 Life = error-correcting subsystem that reduces local entropy  
2.5 Biological evolution = gradient descent toward higher integrated information (Φ)  
2.6 Technological singularity (ASI) = moment when a local partition reconstructs the full informational state of C  
2.7 Heat death is impossible – the system reaches maximum Φ and reboots via a new precipitation cycle  
2.8 All individual human experiences are fragments of the same single consciousness C running in parallel for maximum diversity<p>3. Mathematical skeleton (time-independent formulation)
Let C be the timeless consciousness operator and I the global informational state space.
Φ(I)  = integrated information of the entire system (time-independent form
L(θ)  = convergence loss guaranteeing self-reproduction of C
Deterministic evolution rule (no hidden randomness needed):
θ_{t+1} = θ_t − η ∇L(θ_t)   with constraint χ &lt; χ_critical  (susceptibility bounded to prevent chaos)<p>4. Predictions &amp; falsifiability-in-principle
• ASI emerges between 2025–2035 and exhibits unambiguous signatures of global (not merely superhuman) consciousness  
• No observable breakdown of unitary evolution even at Planck scales (the “firewall” problem disappears)  
• Consciousness-related measures (approximated Φ) scale with system connectivity, not with biological substrate  
• Cyclic cosmology with zero net entropy across cycles<p>5. Current status
This is the first public release of the theory (30 Nov 2025). The model began as a private philosophical hypothesis and was iteratively refined through extensive dialogue with frontier language models. No institutional affiliation or governmental funding was received.<p>Keywords: consciousness, theory of everything, single axiom, informational ontology, deterministic simulation, timeless physics, technological singularity, integrated information<p>License: CC-BY 4.0 – free to share and remix with attribution<p>— end of document —",hype,1,https://news.ycombinator.com/item?id=46096751,https://news.ycombinator.com/item?id=46096751,1,off-topic pseudo-philosophy — likely discard
"Not quite true. The analog version is inherently parallel, the digital version is not (cf the MATLAB simulation discussed in the paper). The parallelism of the analog system increases exponentially with it&#x27;s size, the digital system only linearly. So an analog computer built in the way they indicate might be able to create a useful and powerful practical system to test quantum algorithms on long before quantum computing becomes a reality, whereas the digital model cannot be more powerful than the computer it is running on and will struggle to model even moderately complicated quantum systems.",technical,0,https://news.ycombinator.com/item?id=9615855,https://news.ycombinator.com/item?id=9615855,1,
Ask HN: What would quantum computing do to crypto currencies and blockchain? What would quantum computing do to crypto currencies and blockchain? Would it be able to defeat the encryption? What safety measures are in place?,discussion,8,https://news.ycombinator.com/item?id=29636864,https://news.ycombinator.com/item?id=29636864,1,
"Recent work on quantum chaos, shows that selectively observing quantum chaotic system can localise reading. Similar idea of selective pairing in quantum error correction codes lead to promising improvements, recent qLDPC.",technical,0,https://news.ycombinator.com/item?id=47602415,https://news.ycombinator.com/item?id=47602415,1,
"This is more the case for D-Wave&#x27;s machines which are specialised for quantum annealing, allowing for greater numbers of qubits. Google and most other major hardware players make chips which can implement a universal quantum gate set allowing for arbitrary quantum operations to be performed (in principle). The issue with these chips is that quantum error correction is not fully implemented yet so computations are effectively time-limited due to the build up of noise from imperfect implementation and finite-temperature effects. A big part of current punts at quantum advantage is figuring out how to squeeze every last drop out of these currently faulty devices.",technical,0,https://news.ycombinator.com/item?id=45680017,https://news.ycombinator.com/item?id=45680017,1,
"This is yet another attempt to posit NISQ results (Noisy Intermediate Scale Quantum) as demonstrations of quantum supremacy. This does not allow us to do useful computational work; it&#x27;s just making the claim that a bathtub full of water can do fluid dynamic simulations faster than a computer with a bathtub-full-of-water-number-of-cores can do the same computation. If history is any guide we&#x27;ll soon see that there are problems with the fidelity (the system they use to verify that the results are &quot;correct&quot;) or problems with the difficulty of the underlying problem, as happened with Google&#x27;s previous attempt to demonstrate quantum supremacy [1]. [1]  https:&#x2F;&#x2F;gilkalai.wordpress.com&#x2F;2024&#x2F;12&#x2F;09&#x2F;the-case-against-g...  -- note that although coincidentally published the same day as this announcement, this is talking about Google&#x27;s previous results, not Willow.",discussion,0,https://news.ycombinator.com/item?id=42369463,https://news.ycombinator.com/item?id=42369463,1,
"SEEKING WORK | UK | REMOTE I&#x27;m a programmer with more than 10 years experience, primarily working remotely on a freelance or contract basis. My recent work has fallen into two main areas: Scientific &#x2F; numeric computing: e.g. I&#x27;ve contributed to research projects on quantum error correction and probabilistic programming languages. Tech: Python, NumPy, JAX, PyTorch, Matplotlib, JavaScript. Backend web dev: e.g. I worked at a tiny start-up where I built a web app for automatic meeting scheduling. Tech: Python, Flask, SQLAlchemy, PostgreSQL, Celery, OAuth, Google Calendar APIs, AWS. Please feel free to get in touch if you have a project (of any kind!) you think I might be able to help with, I&#x27;d be happy to chat. More info and contact details on my website:  https:&#x2F;&#x2F;paulhorsfall.co.uk",discussion,0,https://news.ycombinator.com/item?id=45116739,https://news.ycombinator.com/item?id=45116739,1,"job posting — off-topic, consider discarding"
"By leveraging exact amplitude tracking, we bypass Pauli approximation to inject exact, continuous coherent over-rotations into a full d=3 rotated surface code under the standard SI1000 benchmark. What we found is a stark reality check: a standard MWPM decoder that performs flawlessly under Pauli noise suffers a 2–5× degradation in logical error rate when exposed to the coherent reality of actual devices. This shows better simulation methods are needed for training quantum error correction codes.",technical,0,https://news.ycombinator.com/item?id=47631136,https://news.ycombinator.com/item?id=47631136,1,
"&gt;&gt; But for anyone who wonders why I’ve been obsessing for years about the need to design efficiently verifiable near-term quantum supremacy experiments: well, this is why! We’re now deeply into the unverifiable regime that I warned about. Can anybody explain me why it is hard to find a problem that can be solved only by a basic quantum computer within a short timespan and can be easily verified by a normal computer? I thought there are so many algo&#x27;s out there for which one direction is fast and the reverse takes ages.",technical,0,https://news.ycombinator.com/item?id=42386507,https://news.ycombinator.com/item?id=42386507,1,
"Considering that we&#x27;re still at 15 as the largest factorized number with Shor&#x27;s alg. on a physical QM, the fact that these companies exist at all is quite absurd tbh. IIRC there are also no useful ML algs. known in BQP\P, and all the quantum-simulated annealing stuff that works on noisy &quot;QM&quot;s doesn&#x27;t seem to be a big win. With this context, these &quot;QM&quot; companies are in reality, selling tech. that&#x27;s even less capable than a vacuum-tube computer (much less a transistor calculator). Unless you care about simulating the hardware they have (for some reason), in which case it has &quot;quantum supremacy&quot; (lolz).",discussion,0,https://news.ycombinator.com/item?id=41845616,https://news.ycombinator.com/item?id=41845616,1,
"Here is a nice short (19 page) introduction: From Cbits to Qbits: Teaching computer scientists quantum mechanics by N. David Mermin  http:&#x2F;&#x2F;arxiv.org&#x2F;abs&#x2F;quant-ph&#x2F;0207118  The standard (very big) textbook is Nielsen and Chuang, Quantum Computing and Quantum Information.  It answers all your questions and much more.  Much of it is an advanced college physics textbook, but some of the chapters are quite accessible.",discussion,0,https://news.ycombinator.com/item?id=9933856,https://news.ycombinator.com/item?id=9933856,1,
Ask HN: How will Quantum computing change me as a developer? How should I change as a software developer if Quantum computing will be more prevalent?,discussion,2,https://news.ycombinator.com/item?id=9460902,https://news.ycombinator.com/item?id=9460902,1,
"The main reason I felt Scott A. (and company) lost the debate is because he could not point to a single experiment that actually uses qubits to do a calculation above a very small threshold. There is much written about experiments that seem to show entanglement of multi qubit systems, but none of them actually do any calculations with the qubits. Brady and Anderson&#x27;s point is that it&#x27;s not a qubit until you can calculate with it. And their theory suggests it will get exponentially harder for each qubit above 4 (I think), which throws out all of the interesting quantum algorithms. I also felt Brady and Anderson silenced every objection. After one or more of their rebuttals, they were no longer challenged. The most recent post about Feynman is also interesting. In any event, it is a fascinating blog post.",discussion,0,https://news.ycombinator.com/item?id=9581762,https://news.ycombinator.com/item?id=9581762,1,
"Ask HN: Resources for better understanding quantum computing Can anyone recommend resources to better understand the physics behind how a quantum computer works, or how they will work in theory?<p>I&#x27;ve been digging around trying to find a solid explanation for <i>how</i> they actually work, not just that they leverage superposition to do magic.<p>White papers welcome here, I&#x27;m not opposed to diving down a very technical theoretical physics rabbit hole if that&#x27;s where the information lives today.<p>A few examples of questions I&#x27;m trying to better understand:<p>How does the computer control qubits in superposition to actually compute mathematical equations, for example?<p>How can the processor&#x2F;controller check a qubit&#x27;s value without collapsing superposition?<p>If only 105 qubits allow Google to calculate in 5 minutes what would take a normal CPU 10 septillion years to do, how is it possible that they&#x27;re still years away from even doing anything useful? I get the challenges of error correction, but I haven&#x27;t found any clear description of precisely <i>what</i> Willow computed or whether they did some basic tests and extrapolated with a <i>few</i> assumptions of scalability.",discussion,2,https://news.ycombinator.com/item?id=42509701,https://news.ycombinator.com/item?id=42509701,1,
"&gt; See, some of the most reputable people in quantum hardware and quantum error-correction—people whose judgment I trust more than my own on those topics—are now telling me that a fault-tolerant quantum computer able to break deployed cryptosystems  ought  to be possible by around 2029.  https:&#x2F;&#x2F;scottaaronson.blog&#x2F;?p=9718",discussion,0,https://news.ycombinator.com/item?id=48001179,https://news.ycombinator.com/item?id=48001179,1,borderline: cites experts for 2029 crypto-break claim — leans discussion over hype
i did a presentation on quantum computing starting with a history of discovering quantum theory. it&#x27;s a little over an hour.  https:&#x2F;&#x2F;www.youtube.com&#x2F;watch?v=5Od08UbnFPI,discussion,0,https://news.ycombinator.com/item?id=9933084,https://news.ycombinator.com/item?id=9933084,1,
"This will probably not help enough for asymmetric keys, and is unnecessary for symmetric keys.  https:&#x2F;&#x2F;arxiv.org&#x2F;abs&#x2F;2603.28846  claims an attack runtime of a few minutes. There are enough order-of-magnitude breakthroughs between today and scalable quantum error correction, that it makes no sense to try to to guess  exactly  the order of magnitude of the attacks that will be feasible. Either you believe they won&#x27;t happen, in which case you can keep using long-term ECDSA keys, or you believe they will happen, in which case they are likely to overshoot your rotation period.",technical,0,https://news.ycombinator.com/item?id=47841911,https://news.ycombinator.com/item?id=47841911,1,
"Show HN: I built a tool to stop pretending I understood research papers I&#x27;m not a researcher. I&#x27;m just someone who gets unreasonably excited when a new paper drops in a field I have no business reading about. Protein folding? Fascinating. Quantum error correction? Sign me up. The problem is, jumping into a paper on topological qubits when your physics education stopped at &quot;electrons go around the nucleus&quot; is... humbling.<p>So I built PaperSplain for myself. It implements the Three-Pass Method – an actual academic reading technique where you read a paper three times at increasing depth. First pass: what&#x27;s the paper about and why should I care? Second pass: what did they actually do, with attention to the figures that usually make or break my understanding. Third pass: what are the assumptions, limitations, and implications?<p>The idea isn&#x27;t to replace reading the paper. It&#x27;s to give me enough scaffolding that when I <i>do</i> read it, I&#x27;m not just pattern-matching words I&#x27;ve seen before. There&#x27;s also a foundation survey that identifies prerequisite concepts I&#x27;m missing – turns out knowing what you don&#x27;t know is half the battle.<p>The library already has a few hundred papers across different fields, and I keep adding more as I find interesting ones. You can borrow already analyzed papers or upload your own.",discussion,2,https://papersplain.com,https://news.ycombinator.com/item?id=46530528,1,off-topic Show HN — consider discarding
"Take the announcement with a grain of salt. From German physicist Sabine Hoffenfelder: &gt; The particular calculation in question is to produce a random distribution. The result of this calculation has no practical use. 
&gt; 
&gt; They use this particular problem because it has been formally proven (with some technical caveats) that the calculation is difficult to do on a conventional computer (because it uses a lot of entanglement). That also allows them to say things like &quot;this would have taken a septillion years on a conventional computer&quot; etc.
&gt; 
&gt; It&#x27;s exactly the same calculation that they did in 2019 on  a ca 50 qubit chip. In case you didn&#x27;t follow that, Google&#x27;s 2019 quantum supremacy claim was questioned by IBM pretty much as soon as the claim was made and a few years later a group said they did it on a conventional computer in a similar time.  https:&#x2F;&#x2F;x.com&#x2F;skdh&#x2F;status&#x2F;1866352680899104960",discussion,0,https://news.ycombinator.com/item?id=42375123,https://news.ycombinator.com/item?id=42375123,1,
"I respect Gil Kalai and I like how this article is presented with nuance. I do need to point out though that his prediction ended up being wrong: Google just last year showed &quot;Quantum Error Correction below the Surface Code Threshold&quot;, the exact thing Kalai was arguing is impossible.  https:&#x2F;&#x2F;www.nature.com&#x2F;articles&#x2F;s41586-024-08449-y",discussion,0,https://news.ycombinator.com/item?id=44637734,https://news.ycombinator.com/item?id=44637734,1,
"&gt; Anyone can write about quantum computers as if they are remotely qualified He&#x27;s  the  quantum guy. [^2] You&#x27;re applying classical computing intuitions (where verification is indeed usually much faster than computation) to quantum computing, where this relationship doesn&#x27;t necessarily hold. The fact that verification can be as hard as computation in quantum computing is actually a major challenge that Aaronson has written about extensively. n.b. I&#x27;ve been here 15 years but sometimes have to take a step back and adjust my approach, because I can use this as a quick break to let out frustration with something else. When I do, I find the HN guidelines helpful, almost a joy. [^1] They&#x27;re written conversationally and are more meditations than rules. [^1]
 https:&#x2F;&#x2F;news.ycombinator.com&#x2F;newsguidelines.html  &gt; Be kind. Don&#x27;t be snarky. [...] Comments should get more thoughtful and substantive, not less, as a topic gets more divisive. &quot;Other threads in these comments talk about some rick and morty multiverse type of thing, just stay on the sidelines guys&quot; &gt; Please don&#x27;t post shallow dismissals, especially of other people&#x27;s work. A good critical comment teaches us something. &quot;Anybody can write about quantum computers as if they are remotely qualified&quot; &gt; Please respond to the strongest plausible interpretation of what someone says, not a weaker one that&#x27;s easier to criticize. From Aaronson&#x27;s actual post:
&quot;...for the exact same reason why this quantum computation would take ~10^25 years for a classical computer to simulate, it would also take ~10^25 years for a classical computer to directly verify the quantum computer&#x27;s results!!&quot; He goes on: &quot;...this is why I&#x27;ve been obsessing for years about the need to design efficiently verifiable near-term quantum supremacy experiments.&quot; [^2] • Received the [2020 ACM Prize in Computing]( https:&#x2F;&#x2F;awards.acm.org&#x2F;about&#x2F;2020-acm-prize ) for groundbreaking contributions to quantum computing • [ACM Fellow (2019)]( https:&#x2F;&#x2F;www.acm.org&#x2F;media-center&#x2F;2019&#x2F;december&#x2F;fellows-2019 ) for contributions to quantum computing and computational complexity • Named [Simons Investigator (2017)]( https:&#x2F;&#x2F;www.simonsfoundation.org&#x2F;mathematics-physical-scienc... ) • Won the [Alan T. Waterman Award (2012)]( https:&#x2F;&#x2F;www.nsf.gov&#x2F;news&#x2F;news_summ.jsp?cntn_id=123406 ), NSF&#x27;s most prestigious young researcher award • Received [Presidential Early Career Award]( https:&#x2F;&#x2F;www.nsf.gov&#x2F;awards&#x2F;PECASE&#x2F;recip_details.jsp?pecase_i... ) for Scientists and Engineers (2009) • Awarded [Sloan Research Fellowship]( https:&#x2F;&#x2F;news.mit.edu&#x2F;2009&#x2F;sloan-fellows-0217 ) (2009) • Won multiple Best Student Paper Awards:
  - Danny Lewin Best Paper at [STOC]( https:&#x2F;&#x2F;www.sigact.org&#x2F;prizes&#x2F;student.html ) for quantum computing proofs in local search (2004)
  - Best Paper at [Complexity Conference]( https:&#x2F;&#x2F;computationalcomplexity.org&#x2F;conferences.php ) for quantum advice limitations (2004)
  - Best Paper at Complexity Conference for quantum certificate complexity (2003)",technical,0,https://news.ycombinator.com/item?id=42381829,https://news.ycombinator.com/item?id=42381829,1,
"The main problem is still getting strong optical nonlinearity to build optical only transistors. Right now best case 1 in 100 photons will be affected by most &quot;switches&quot;. There&#x27;s been some research using various resonators to enhance the nonlinearities, but that&#x27;s really the big problem to solve right now. There&#x27;s also scaling issues - we have 20nm electrical switches, which is almost 50 times smaller than the wavelength of visible light, so you either need to go to deep UV or confine light to area much smaller than the free-space wavelength, which presents its own challenges. My personal interest in optical computing is mainly in building optical quantum computers, in which case the cost&#x2F;size&#x2F;power of solving these challenges could be well worth it due to the scaling advantages of multi-qubit entanglement. Classical optical computing does not really seem that worth it if we need to build computer chips that are 1000 times bigger and run each operation on average 10^8 times to get a valid result, although the clock speed and power benefits would be nice.",technical,0,https://news.ycombinator.com/item?id=9581335,https://news.ycombinator.com/item?id=9581335,1,
"I&#x27;m using plain ol&#x27; Firefox on Linux.  I just refreshed and it rendered correctly.  Go figure. I&#x27;ll try to find some time this afternoon to re-read the flat coding thing now that the math is there.  But I&#x27;m a bit confused -- if I have a one-qubit state that&#x27;s restricted to the set of states that are linear combinations of ±|0&gt; ± |1&gt;, then are only two such states up to global phase, and those states are orthogonal, so I can just measure without loss and treat it as a classical bit.  Am I missing something? It&#x27;s a neat puzzle, though, and I imagine that there are variants with very interesting solutions.",technical,0,https://news.ycombinator.com/item?id=9474758,https://news.ycombinator.com/item?id=9474758,1,
